<?xml version="1.0" encoding="UTF-8"?>
<xsd:schema xmlns:xsd="http://www.w3.org/2001/XMLSchema" xmlns:od="urn:schemas-microsoft-com:officedata">
<xsd:element name="dataroot">
<xsd:complexType>
<xsd:sequence>
<xsd:element ref="Level_6_2" minOccurs="0" maxOccurs="unbounded"/>
</xsd:sequence>
<xsd:attribute name="generated" type="xsd:dateTime"/>
</xsd:complexType>
</xsd:element>
<xsd:element name="Level_6_2">
<xsd:annotation>
<xsd:appinfo>
<od:tableProperty name="GUID" type="9" value="4oJV+NwrhUeCVQCBcmrHrg==
"/>
<od:tableProperty name="Orientation" type="2" value="0"/>
<od:tableProperty name="OrderByOn" type="1" value="1"/>
<od:tableProperty name="NameMap" type="11" value="CswOVQAAAADiglX43CuFR4JVAIFyaseuAAAAAEi9CTqW7eVAAAAAAAAAAABMAGUA
dgBlAGwAXwA2AF8AMgAAAAAAAAD9J9aXFm+NRZ8a23IR5jE3BwAAAOKCVfjcK4VH
glUAgXJqx65zAHAAZQBsAGwAaQBuAGcAAAAAAAAAwCpFFeoQwk2xRx0B077rpwcA
AADiglX43CuFR4JVAIFyaseucABoAG8AbgBlAHQAaQBjAAAAAAAAAP2NX+m2eC9P
hIjUvtwgp5MHAAAA4oJV+NwrhUeCVQCBcmrHrmQAZQBmAGkAbgBpAHQAaQBvAG4A
XwAxAAAAAAAAANKCBSFq9TdHkeetmg6LBZgHAAAA4oJV+NwrhUeCVQCBcmrHrmQA
ZQBmAGkAbgBpAHQAaQBvAG4AXwAyAAAAAAAAAAAAAAAAAAAAAAAAAAAAAAAMAAAA
BQAAAAAAAAAAAAAAAAAAAAAA
"/>
<od:tableProperty name="DefaultView" type="2" value="2"/>
<od:tableProperty name="DisplayViewsOnSharePointSite" type="2" value="1"/>
<od:tableProperty name="TotalsRow" type="1" value="0"/>
<od:tableProperty name="FilterOnLoad" type="1" value="0"/>
<od:tableProperty name="OrderByOnLoad" type="1" value="1"/>
<od:tableProperty name="HideNewField" type="1" value="0"/>
<od:tableProperty name="BackTint" type="6" value="100"/>
<od:tableProperty name="BackShade" type="6" value="100"/>
<od:tableProperty name="ThemeFontIndex" type="4" value="-1"/>
<od:tableProperty name="AlternateBackThemeColorIndex" type="4" value="-1"/>
<od:tableProperty name="AlternateBackTint" type="6" value="100"/>
<od:tableProperty name="AlternateBackShade" type="6" value="100"/>
<od:tableProperty name="ReadOnlyWhenDisconnected" type="1" value="0"/>
<od:tableProperty name="DatasheetGridlinesThemeColorIndex" type="4" value="-1"/>
<od:tableProperty name="DatasheetForeThemeColorIndex" type="4" value="-1"/>
<od:tableProperty name="OrderBy" type="12" value="[Level_6_2].[spelling]"/>
<od:tableProperty name="PublishToWeb" type="2" value="1"/>
</xsd:appinfo>
</xsd:annotation>
<xsd:complexType>
<xsd:sequence>
<xsd:element name="spelling" minOccurs="0" od:jetType="text" od:sqlSType="nvarchar">
<xsd:annotation>
<xsd:appinfo>
<od:fieldProperty name="GUID" type="9" value="/SfWlxZvjUWfGttyEeYxNw==
"/>
<od:fieldProperty name="ColumnWidth" type="3" value="4932"/>
<od:fieldProperty name="ColumnOrder" type="3" value="1"/>
<od:fieldProperty name="ColumnHidden" type="1" value="0"/>
<od:fieldProperty name="Required" type="1" value="0"/>
<od:fieldProperty name="AllowZeroLength" type="1" value="1"/>
<od:fieldProperty name="DisplayControl" type="3" value="109"/>
<od:fieldProperty name="IMEMode" type="2" value="1"/>
<od:fieldProperty name="IMESentenceMode" type="2" value="3"/>
<od:fieldProperty name="UnicodeCompression" type="1" value="0"/>
<od:fieldProperty name="TextAlign" type="2" value="0"/>
<od:fieldProperty name="AggregateType" type="4" value="-1"/>
<od:fieldProperty name="ResultType" type="2" value="0"/>
<od:fieldProperty name="CurrencyLCID" type="4" value="0"/>
</xsd:appinfo>
</xsd:annotation>
<xsd:simpleType>
<xsd:restriction base="xsd:string">
<xsd:maxLength value="255"/>
</xsd:restriction>
</xsd:simpleType>
</xsd:element>
<xsd:element name="phonetic" minOccurs="0" od:jetType="text" od:sqlSType="nvarchar">
<xsd:annotation>
<xsd:appinfo>
<od:fieldProperty name="GUID" type="9" value="wCpFFeoQwk2xRx0B077rpw==
"/>
<od:fieldProperty name="ColumnWidth" type="3" value="4824"/>
<od:fieldProperty name="ColumnOrder" type="3" value="2"/>
<od:fieldProperty name="ColumnHidden" type="1" value="0"/>
<od:fieldProperty name="Required" type="1" value="0"/>
<od:fieldProperty name="AllowZeroLength" type="1" value="1"/>
<od:fieldProperty name="DisplayControl" type="3" value="109"/>
<od:fieldProperty name="IMEMode" type="2" value="1"/>
<od:fieldProperty name="IMESentenceMode" type="2" value="3"/>
<od:fieldProperty name="UnicodeCompression" type="1" value="0"/>
<od:fieldProperty name="TextAlign" type="2" value="0"/>
<od:fieldProperty name="AggregateType" type="4" value="-1"/>
<od:fieldProperty name="ResultType" type="2" value="0"/>
<od:fieldProperty name="CurrencyLCID" type="4" value="0"/>
</xsd:appinfo>
</xsd:annotation>
<xsd:simpleType>
<xsd:restriction base="xsd:string">
<xsd:maxLength value="255"/>
</xsd:restriction>
</xsd:simpleType>
</xsd:element>
<xsd:element name="definition_1" minOccurs="0" od:jetType="text" od:sqlSType="nvarchar">
<xsd:annotation>
<xsd:appinfo>
<od:fieldProperty name="GUID" type="9" value="/Y1f6bZ4L0+EiNS+3CCnkw==
"/>
<od:fieldProperty name="ColumnWidth" type="3" value="3276"/>
<od:fieldProperty name="ColumnOrder" type="3" value="3"/>
<od:fieldProperty name="ColumnHidden" type="1" value="0"/>
<od:fieldProperty name="Required" type="1" value="0"/>
<od:fieldProperty name="AllowZeroLength" type="1" value="1"/>
<od:fieldProperty name="DisplayControl" type="3" value="109"/>
<od:fieldProperty name="IMEMode" type="2" value="1"/>
<od:fieldProperty name="IMESentenceMode" type="2" value="3"/>
<od:fieldProperty name="UnicodeCompression" type="1" value="0"/>
<od:fieldProperty name="TextAlign" type="2" value="0"/>
<od:fieldProperty name="AggregateType" type="4" value="-1"/>
<od:fieldProperty name="ResultType" type="2" value="0"/>
<od:fieldProperty name="CurrencyLCID" type="4" value="0"/>
</xsd:appinfo>
</xsd:annotation>
<xsd:simpleType>
<xsd:restriction base="xsd:string">
<xsd:maxLength value="255"/>
</xsd:restriction>
</xsd:simpleType>
</xsd:element>
<xsd:element name="definition_2" minOccurs="0" od:jetType="text" od:sqlSType="nvarchar">
<xsd:annotation>
<xsd:appinfo>
<od:fieldProperty name="GUID" type="9" value="0oIFIWr1N0eR562aDosFmA==
"/>
<od:fieldProperty name="ColumnWidth" type="3" value="4356"/>
<od:fieldProperty name="ColumnOrder" type="3" value="4"/>
<od:fieldProperty name="ColumnHidden" type="1" value="0"/>
<od:fieldProperty name="Required" type="1" value="0"/>
<od:fieldProperty name="AllowZeroLength" type="1" value="1"/>
<od:fieldProperty name="DisplayControl" type="3" value="109"/>
<od:fieldProperty name="IMEMode" type="2" value="1"/>
<od:fieldProperty name="IMESentenceMode" type="2" value="3"/>
<od:fieldProperty name="UnicodeCompression" type="1" value="0"/>
<od:fieldProperty name="TextAlign" type="2" value="0"/>
<od:fieldProperty name="AggregateType" type="4" value="-1"/>
<od:fieldProperty name="ResultType" type="2" value="0"/>
<od:fieldProperty name="CurrencyLCID" type="4" value="0"/>
</xsd:appinfo>
</xsd:annotation>
<xsd:simpleType>
<xsd:restriction base="xsd:string">
<xsd:maxLength value="255"/>
</xsd:restriction>
</xsd:simpleType>
</xsd:element>
</xsd:sequence>
</xsd:complexType>
</xsd:element>
</xsd:schema>
